{
  "schema_version": 1,
  "app_id": "photoshop",
  "open": [
    { "type": "open_app", "platform_specific": true }
  ],
  "default_dispatch_strategy": [
    "shortcut_lookup",
    "menu_navigation",
    "vision_fallback"
  ],
  "verification_default": "interpret_check",
  "failure_recovery": [
    "retry_same_shortcut_once",
    "wait_for_idle",
    "fallback_to_alternative_method",
    "escalate_to_explorer",
    "surface_to_user"
  ],
  "pre_step": [
    { "type": "key", "key": "escape" }
  ]
}
